{
  "id": 1122334455,
  "id_str": "1122334455",
  "advice": "accept",
  "info": {
    "fingerprint": {
      "signals": [],
      "profiling_type": "ios",
      "attempt_reference": "mznx-012eebc9-36ff-498c-a160-dcc52430bbf0-i",
      "created_date": "2020-08-29 10:12:13.120002",
      "ip": "1.2.3.4",
      "proxied_for_ip": null,
      "device": {
        "battery": {
          "charging": false,
          "level": 35.0,
          "fully_charged": false
        },
        "carrier": {
          "iso_country_code": "pl",
          "mobile_country_code": "260",
          "name": "Carrier",
          "mobile_network_code": "06",
          "allows_voip": true,
          "country": "PL"
        },
        "disk": {
          "total_space": 63978983424.0,
          "free_space": 1234123412.0
        },
        "hardware": {
          "device_model": "iPhone",
          "model": "D211AP",
          "uptime": "1 8 2",
          "device_name": "iPhone",
          "orientation": "portrait",
          "device_system_name": "iOS",
          "device_system_version": "14.8",
          "multitasking_enabled": true,
          "proximity_sensor_enabled": false,
          "device_identifier_for_vendor": "ALFB6KYV-OSNV-PHAY-CKW0-GJJF8JXPTSNX"
        },
        "process_info": {
          "system_version_string": "Version 14.8 (Build 18H17)",
          "processor_count": 6,
          "active_processor_count": 6,
          "physical_memory": "3117711360",
          "low_power_enabled": true
        },
        "bluetooth": null
      },
      "network": {
        "external_ip_address": "1.2.3.4",
        "connected_to_wifi": false,
        "wifi_ip_address": null,
        "connected_to_cell_network": true,
        "cell_ip_address": "11.22.33.44",
        "link_type": "",
        "user_declared_ip": {
          "addr": "1.2.3.4"
        }
      },
      "client": {
        "localization": {
          "country": "pl_PL",
          "currency": "zł",
          "language": "pl-PL",
          "region": "PL",
          "calendar": "gregorian",
          "currency_code": "PLN",
          "metric_system": true,
          "time_zone": "Europe/Warsaw"
        },
        "preference": {
          "preferred_content_size_category": "UICTContentSizeCategoryS",
          "can_send_mail": true,
          "can_send_text": true
        },
        "accessibility": {
          "is_bold_text": false,
          "is_undo_shake": true,
          "is_reduced_motion": false,
          "is_reduced_transparency": false,
          "is_assistive_touch": false,
          "is_darker_system_colors": false,
          "is_switch_control": false,
          "is_voice_over": false,
          "is_mono_audio": false,
          "is_inverted_color": false,
          "is_closed_caption": false,
          "is_grayscale": false,
          "is_video_autoplay": true,
          "is_guided_access": false,
          "is_speak_selection": false,
          "is_speak_screen": false,
          "is_diff_without_color": false,
          "is_switch_label": false
        }
      }
    }
  }
}
