{
  "id": 1122334455,
  "id_str": "1122334455",
  "advice": "accept",
  "info": {
    "fingerprint": {
      "signals": [],
      "profiling_type": "android",
      "attempt_reference": "mznx-3c0a631c-0d7a-40a0-a645-e1910fa2d52a-a",
      "created_date": "2020-08-29 09:11:10.990001",
      "ip": "1.2.3.4",
      "proxied_for_ip": null,
      "network": {
        "link_type": "",
        "user_declared_ip": {
          "addr": "1.2.3.4"
        }
      },
      "device": {
        "carrier": {
          "name": "Carrier",
          "country": "pl",
          "iso_country_code": "pl",
          "mobile_country_code": "260",
          "mobile_network_code": "02",
          "allows_voip": true,
          "icc_card": true,
          "roaming": false,
          "sim_state": 5,
          "radio_phone_type": 1,
          "network_type": null
        },
        "disk": {
          "total_space": "5622530000",
          "free_space_root": "12341234"
        },
        "device": {
          "android_id": "i3u46d5wv6zvg2i5",
          "model": "SM-A715F",
          "manufacturer": "samsung",
          "brand": "samsung",
          "build_fingerprint": "samsung/a71naeea/a71:11/RP1A.200720.012/DHLCUVTT2W4HU:user/release-keys",
          "product": "a71naeea",
          "http_proxy": null,
          "wifi_on": false,
          "bt_on": true,
          "uptime_ms": "587920381"
        },
        "battery": {
          "battery_health": "good",
          "extra_health": 2,
          "level": 50.0,
          "extra_level": 50,
          "extra_scale_level": 100,
          "plugged": "battery",
          "extra_plugged": 0,
          "charging_state": "discharging",
          "extra_status": 3,
          "extra_present": true,
          "extra_technology": "Li-ion",
          "extra_temperature": 349,
          "extra_voltage": 3775
        }
      }
    }
  }
}
