{
  "id": 1122334455,
  "id_str": "1122334455",
  "advice": "refuse",
  "info": {
    "rules": [
      {
        "id": 123456789,
        "id_str": "123456789",
        "name": "BlacklistEmail",
        "advice": "accept",
        "mode": "normal"
      },
      {
        "id": 6543351234,
        "id_str": "6543351234",
        "name": "SameFPCDifferentEmail",
        "advice": "review",
        "mode": "simulation"
      },
      {
        "id": 967895437,
        "id_str": "967895437",
        "name": "FingerprintIpFromDifferentCountries",
        "advice": "refuse",
        "mode": "normal"
      },
      {
        "id": 456789876523,
        "id_str": "456789876523",
        "name": "IPCount",
        "advice": "skip",
        "mode": "normal"
      }
    ]
  }
}
