{
  "id": 1122334455,
  "id_str": "1122334455",
  "advice": "accept",
  "info": {
    "ip_info": {
      "input_ip": {
        "ip": "198.51.100.12",
        "city_name": "Warsaw",
        "country_code": "PL",
        "country_name": "Poland",
        "latitude": 52.2176,
        "longitude": 21.0071,
        "time_zone": "Europe/Warsaw",
        "postal_code": "01-000",
        "autonomous_system_number": 123123,
        "autonomous_system_organization": "Example ASN Org.",
        "isp": "Example ISP"
      },
      "profiler_ip": {
        "ip": "198.51.100.0",
        "city_name": "Warsaw",
        "country_code": "PL",
        "country_name": "Poland",
        "latitude": 52.2176,
        "longitude": 21.0071,
        "time_zone": "Europe/Warsaw",
        "postal_code": "01-000",
        "autonomous_system_number": 123123,
        "autonomous_system_organization": "Example ASN Org.",
        "isp": null
      }
    }
  }
}
