{
  "id": 1122334455,
  "id_str": "1122334455",
  "advice": "refuse",
  "info": {
    "models": [
      {
        "name": "anti-fraud",
        "prediction": {
          "value": 0.4,
          "extra_data": {}
        }
      },
      {
        "name": "customer_segmentation",
        "prediction": {
          "values": {
            "Class A": 0.5,
            "Class B": 0.1,
            "Class C": 0.4
          },
          "extra_data": {}
        }
      },
      {
        "name": "similar_users",
        "prediction": {
          "value": 1.7,
          "extra_data": {
            "most_similar": [
              {
                "references": {
                  "inquiry_id": "1323440692323580514",
                  "attempt_reference": "15698859736366053241569887422",
                  "profiling_reference": "11C64430B4B2DB1A",
                  "user_reference": "12398432423"
                },
                "similarity": 1.5
              },
              {
                "references": {
                  "inquiry_id": "1323440692323580513",
                  "attempt_reference": "15698859736366053241569887421",
                  "profiling_reference": "11A64430B4B2DB1A",
                  "user_reference": "82398432403"
                },
                "similarity": 0.5
              }
            ]
          }
        }
      }
    ]
  }
}
