{
  "id": 1122334455,
  "id_str": "1122334455",
  "advice": "refuse",
  "info": {
    "fingerprint": {
      "signals": ["Keyboard not used"],
      "first_persistent_cookie": "f3ae6977-57fe-4841-bec6-9cb1498bd444",
      "profiling_type": "web",
      "cookie_first_seen": "2020-08-29 10:11:39.096000+00:00",
      "attempt_reference": "54d44064-3c16-40f2-ae05-5b496e082d7d:daef7447-657c-4310-9872-0bb51c5fab3d",
      "created_date": "2020-08-29 11:41:29.570002",
      "ip": "1.2.3.4",
      "proxied_for_ip": null,
      "network": {
        "detected_hops": [
          {
            "addr": "1.2.3.4"
          }
        ],
        "link_type": "",
        "local_ip_addresses": ["0.0.0.0"],
        "user_declared_ip": {
          "addr": "1.2.3.4"
        }
      },
      "client": {
        "cookieEnabled": true,
        "declared": "Chrome",
        "do_not_track": "unknown",
        "entry_point": "https://my.site/order",
        "granular_fingerprint": "064e6b461f5c45a9ab79c260bd321981634cf957",
        "headers": {
          "Host": "TL9M7GYzog.aHjl5eRRqp.com",
          "Accept": "*/*",
          "Cookie": "GYCrYwxCs09MLAFi8uhR=U6etczYsPyV0Fzcs072p5ITUuOA1wbEtyzWqiXHvCNOOF3kcp7urcIffhvPtoNau",
          "Origin": "https://my.site",
          "Referer": "https://my.site/order",
          "Sec-Ch-Ua": "\"Google Chrome\";v=\"95\", \"Chromium\";v=\"95\", \";Not A Brand\";v=\"99\"",
          "User-Agent": "Mozilla/5.0 (Windows NT 6.1) AppleWebKit/537.36 (KHTML, like Gecko) Chrome/95.0.4638.69 Safari/537.36",
          "Content-Type": "",
          "Content-Length": "0",
          "Content_Length": "0",
          "Sec-Fetch-Dest": "empty",
          "Sec-Fetch-Mode": "cors",
          "Sec-Fetch-Site": "cross-site",
          "Accept-Encoding": "gzip, deflate, br",
          "Accept-Language": "pl-PL,pl;q=0.9,en-US;q=0.8,en;q=0.7,de;q=0.6",
          "Sec-Ch-Ua-Mobile": "?0",
          "Sec-Ch-Ua-Platform": "\"Windows\""
        },
        "javaEnabled": false,
        "language": "pl-PL",
        "plugins": {
          "NavigatorMimeTypes": {
            "0": {
              "type": "application/pdf",
              "suffixes": "pdf",
              "description": "Portable Document Format",
              "enabledPlugin": {
                "name": "PDF Viewer",
                "length": 2,
                "filename": "internal-pdf-viewer",
                "description": "Portable Document Format"
              }
            },
            "1": {
              "type": "text/pdf",
              "suffixes": "pdf",
              "description": "Portable Document Format",
              "enabledPlugin": {
                "name": "PDF Viewer",
                "length": 2,
                "filename": "internal-pdf-viewer",
                "description": "Portable Document Format"
              }
            }
          },
          "NavigatorPlugins": {
            "0": {
              "name": "PDF Viewer",
              "length": 2,
              "filename": "internal-pdf-viewer",
              "description": "Portable Document Format"
            },
            "1": {
              "name": "Chrome PDF Viewer",
              "length": 2,
              "filename": "internal-pdf-viewer",
              "description": "Portable Document Format"
            },
            "2": {
              "name": "Chromium PDF Viewer",
              "length": 2,
              "filename": "internal-pdf-viewer",
              "description": "Portable Document Format"
            },
            "3": {
              "name": "Microsoft Edge PDF Viewer",
              "length": 2,
              "filename": "internal-pdf-viewer",
              "description": "Portable Document Format"
            },
            "4": {
              "name": "WebKit built-in PDF",
              "length": 2,
              "filename": "internal-pdf-viewer",
              "description": "Portable Document Format"
            }
          }
        },
        "rendering": "WebKit WebGL",
        "timezone": -60
      },
      "behavior": {
        "clipboard": {
          "data": []
        },
        "fields": [],
        "kb_dwell_time_max": null,
        "kb_dwell_time_mean": null,
        "kb_dwell_time_median": null,
        "kb_dwell_time_min": null,
        "kb_dwell_time_sd": null,
        "kb_flight_time_max": null,
        "kb_flight_time_mean": null,
        "kb_flight_time_median": null,
        "kb_flight_time_min": null,
        "kb_flight_time_sd": null,
        "kb_keys_frequency": null,
        "profiling_time": null,
        "sensor": {
          "motion": {
            "acceleration": {
              "x": null,
              "y": null,
              "z": null
            },
            "accelerationIncludingGravity": {
              "x": null,
              "y": null,
              "z": null
            },
            "action_times": {
              "avg": 0.0,
              "len": 1,
              "max": 0.0,
              "min": 0.0,
              "median": 0.0,
              "std": 0.0
            },
            "event_times": {
              "split": null,
              "split_filtered": null,
              "raw": null,
              "filtered": null
            },
            "pause_times": null,
            "rotationRate": {
              "x": null,
              "y": null,
              "z": null
            },
            "unchanging": {
              "number_of_streaks": 0,
              "longest_streak": 0
            }
          },
          "orientation": {
            "action_times": {
              "avg": 0.0,
              "len": 1,
              "max": 0.0,
              "min": 0.0,
              "median": 0.0,
              "std": 0.0
            },
            "alpha": null,
            "beta": null,
            "event_times": {
              "filtered": null,
              "raw": null,
              "split": null,
              "split_filtered": null
            },
            "gamma": null,
            "pause_times": null,
            "unchanging": {
              "number_of_streaks": 0,
              "longest_streak": 0
            }
          }
        },
        "time_spent_in_hidden": null,
        "time_spent_in_visible": null
      },
      "device": {
        "battery": {
          "level": 1,
          "charging": true,
          "chargingTime": 0,
          "dischargingTime": null
        },
        "concurrency": 4,
        "is_mobile": false,
        "number_of_fonts": 100,
        "os_declared": "Windows",
        "rendering": "ANGLE (NVIDIA, NVIDIA GeForce GT 430 Direct3D11 vs_5_0 ps_5_0, D3D11-23.21.13.8859)",
        "screen": {
          "AvailableResolution": [1360, 728],
          "availableSize": [0, 0],
          "ColorDepth": 24,
          "orientation": {
            "angle": 0,
            "type": "landscape-primary"
          },
          "ScreenResolution": [1360, 768],
          "ViewportSize": [1221, 568],
          "visibility": {
            "hidden": false,
            "visibilityState": "visible"
          },
          "windowSize": {
            "innerHeight": 568,
            "innerWidth": 1236,
            "outerHeight": 728,
            "outerWidth": 1360
          }
        }
      }
    }
  }
}
